{
  "descriptorVersion": "1.0",
  "application": {
    "name": "order-service",
    "ruliiVersion": "2.1.0",
    "explorerVersion": "1.1.0-SNAPSHOT",
    "placeholderValues": false
  },
  "packages": [
    {
      "id": "org.rulii.explorer.fixture",
      "kind": "java"
    }
  ],
  "artifacts": [
    {
      "id": "anotherMinTotalRule",
      "name": "MinTotalRule",
      "type": "rule",
      "kind": "java-builder",
      "registered": true,
      "packageId": "org.rulii.explorer.fixture",
      "description": "A second rule with the same name.",
      "parameters": [
        {
          "name": "total",
          "type": "java.lang.Integer",
          "required": true
        }
      ],
      "rule": {
        "given": {
          "kind": "compiled",
          "reads": [
            "total"
          ],
          "writes": [ ],
          "signature": "boolean test(Integer total)"
        },
        "then": [ ]
      }
    },
    {
      "id": "customValidation",
      "name": "CustomValidation",
      "type": "rule",
      "kind": "java-builder",
      "registered": true,
      "packageId": "org.rulii.explorer.fixture",
      "description": "Order total must be positive.",
      "parameters": [
        {
          "name": "total",
          "type": "java.lang.Integer",
          "required": true
        }
      ],
      "rule": {
        "given": {
          "kind": "compiled",
          "reads": [
            "total"
          ],
          "writes": [ ],
          "signature": "boolean test(Integer total)"
        },
        "then": [ ]
      },
      "validation": {
        "errorCode": "order.total.invalid",
        "severity": "WARNING",
        "settings": { }
      }
    },
    {
      "id": "emailRequired",
      "name": "emailRequired",
      "type": "rule",
      "kind": "predefined-validator",
      "registered": true,
      "packageId": "org.rulii.explorer.fixture",
      "description": "Customer email is required.",
      "parameters": [ ],
      "rule": {
        "then": [ ]
      },
      "validation": {
        "validator": "notNull",
        "errorCode": "customer.email.missing",
        "severity": "ERROR",
        "defaultMessage": "Value must not be null.",
        "valueSource": {
          "kind": "binding",
          "name": "email"
        },
        "failOnNull": true,
        "settings": { }
      }
    },
    {
      "id": "minAge",
      "name": "minAge",
      "type": "rule",
      "kind": "predefined-validator",
      "registered": true,
      "packageId": "org.rulii.explorer.fixture",
      "description": "Customer must be an adult.",
      "parameters": [ ],
      "rule": {
        "then": [ ]
      },
      "validation": {
        "validator": "min",
        "errorCode": "customer.age.min",
        "severity": "ERROR",
        "errorMessage": "{0} must be at least 18",
        "defaultMessage": "Value {0} must be greater than or equal to {1}.",
        "valueSource": {
          "kind": "binding",
          "name": "age"
        },
        "failOnNull": true,
        "settings": {
          "min": 18
        }
      }
    },
    {
      "id": "minTotalRule",
      "name": "MinTotalRule",
      "type": "rule",
      "kind": "java-builder",
      "registered": true,
      "packageId": "org.rulii.explorer.fixture",
      "description": "Order total must meet the minimum.",
      "category": "Orders/Validation",
      "tags": [
        "total",
        "vip"
      ],
      "parameters": [
        {
          "name": "total",
          "type": "java.lang.Integer",
          "required": true
        }
      ],
      "rule": {
        "given": {
          "kind": "compiled",
          "reads": [
            "total"
          ],
          "writes": [ ],
          "signature": "boolean test(Integer total)"
        },
        "then": [
          {
            "kind": "compiled",
            "reads": [
              "total"
            ],
            "writes": [ ],
            "signature": "void run(Integer total)"
          }
        ]
      }
    },
    {
      "id": "orderProcessingFlow/commands[11]/target",
      "name": "InlineTarget",
      "type": "rule",
      "kind": "java-builder",
      "registered": false,
      "packageId": "org.rulii.explorer.fixture",
      "description": "Run by the flow but never registered.",
      "parameters": [ ],
      "rule": {
        "given": {
          "kind": "compiled",
          "reads": [ ],
          "writes": [ ],
          "signature": "boolean test()"
        },
        "then": [ ]
      }
    },
    {
      "id": "orderValidationRules/members[2]",
      "name": "InlineRule",
      "type": "rule",
      "kind": "java-builder",
      "registered": false,
      "packageId": "org.rulii.explorer.fixture",
      "description": "Declared inside the rule set only.",
      "parameters": [
        {
          "name": "total",
          "type": "java.lang.Integer",
          "required": true
        }
      ],
      "rule": {
        "given": {
          "kind": "compiled",
          "reads": [
            "total"
          ],
          "writes": [ ],
          "signature": "boolean test(Integer total)"
        },
        "then": [ ]
      }
    },
    {
      "id": "scriptRule",
      "name": "ScriptRule",
      "type": "rule",
      "kind": "java-builder",
      "registered": true,
      "packageId": "org.rulii.explorer.fixture",
      "description": "Order total must meet the scripted minimum.",
      "parameters": [ ],
      "rule": {
        "given": {
          "kind": "script",
          "language": "java",
          "text": "ctx.total >= 100",
          "plain": {
            "complete": false,
            "tokens": [
              {
                "t": "raw",
                "text": "ctx.total >= 100"
              }
            ]
          },
          "reads": [
            "total"
          ],
          "writes": [ ]
        },
        "then": [ ]
      }
    },
    {
      "id": "stockAvailableRule",
      "name": "StockAvailableRule",
      "type": "rule",
      "kind": "rule-class",
      "registered": true,
      "packageId": "org.rulii.explorer.fixture",
      "category": "Fulfilment",
      "tags": [
        "stock",
        "warehouse"
      ],
      "parameters": [
        {
          "name": "quantity",
          "type": "java.lang.Integer",
          "required": true
        },
        {
          "name": "stock",
          "type": "java.lang.Integer",
          "required": true
        }
      ],
      "rule": {
        "given": {
          "kind": "compiled",
          "reads": [
            "quantity",
            "stock"
          ],
          "writes": [ ],
          "signature": "boolean when(Integer quantity, Integer stock)"
        },
        "then": [
          {
            "kind": "compiled",
            "reads": [
              "quantity"
            ],
            "writes": [ ],
            "signature": "void then(Integer quantity)"
          }
        ]
      }
    },
    {
      "id": "orderValidationRules",
      "name": "orderValidationRules",
      "type": "ruleset",
      "kind": "java-builder",
      "registered": true,
      "packageId": "org.rulii.explorer.fixture",
      "description": "Checks that an order is valid.",
      "category": "Orders/Validation",
      "tags": [
        "validation"
      ],
      "parameters": [
        {
          "name": "order",
          "type": "java.lang.Object",
          "required": true,
          "description": "The order"
        },
        {
          "name": "customer",
          "type": "java.lang.Object",
          "required": false
        }
      ],
      "ruleSet": {
        "validating": true,
        "preCondition": {
          "kind": "compiled",
          "reads": [
            "order"
          ],
          "writes": [ ],
          "signature": "boolean test(Object order)"
        },
        "stopCondition": {
          "kind": "compiled",
          "reads": [
            "violationCount"
          ],
          "writes": [ ],
          "signature": "boolean test(Integer violationCount)"
        },
        "members": [
          "minTotalRule",
          "emailRequired",
          "orderValidationRules/members[2]"
        ]
      }
    },
    {
      "id": "contextFlow",
      "name": "contextFlow",
      "type": "ruleflow",
      "kind": "java-builder",
      "registered": true,
      "packageId": "org.rulii.explorer.fixture",
      "description": "Runs in its own context.",
      "parameters": [ ],
      "ruleFlow": {
        "context": "flowContext",
        "commands": [
          {
            "type": "bind",
            "bind": {
              "kind": "literal",
              "names": [
                {
                  "name": "a",
                  "type": "java.lang.Integer"
                }
              ]
            }
          }
        ]
      }
    },
    {
      "id": "orderProcessingFlow",
      "name": "orderProcessingFlow",
      "type": "ruleflow",
      "kind": "java-builder",
      "registered": true,
      "packageId": "org.rulii.explorer.fixture",
      "description": "Validates, scores, prices and approves an order.",
      "category": "Orders",
      "parameters": [
        {
          "name": "order",
          "type": "java.lang.Object",
          "required": true,
          "description": "The order"
        }
      ],
      "ruleFlow": {
        "commands": [
          {
            "type": "bind",
            "bind": {
              "kind": "literal",
              "names": [
                {
                  "name": "reviewQueue",
                  "type": "java.lang.String"
                }
              ]
            }
          },
          {
            "type": "run",
            "target": {
              "kind": "instance",
              "id": "orderValidationRules",
              "resolution": "direct"
            },
            "as": "validation"
          },
          {
            "type": "when",